{
  "$schema": "http://json-schema.org/draft-07/schema#",
  "title": "GEO Audit request",
  "description": "What to audit. The tier (Quick / Full) is defined by the purchased offering, not by a field.",
  "type": "object",
  "additionalProperties": false,
  "required": ["subject", "subjectType", "category"],
  "properties": {
    "subject": {
      "type": "string",
      "minLength": 2,
      "maxLength": 80,
      "description": "Name of the brand, token, product, protocol or person to audit."
    },
    "subjectType": {
      "type": "string",
      "enum": ["brand", "token", "product", "protocol", "person"],
      "description": "Kind of subject; selects question templates."
    },
    "category": {
      "type": "string",
      "minLength": 2,
      "maxLength": 120,
      "description": "Market category used in unbranded discovery questions, e.g. \"AI agent launchpads\"."
    },
    "aliases": {
      "type": "array",
      "maxItems": 8,
      "items": { "type": "string", "minLength": 1, "maxLength": 80 },
      "description": "Alternative spellings and tickers. \"$TICKER\" also matches \"TICKER\"."
    },
    "domains": {
      "type": "array",
      "maxItems": 8,
      "items": { "type": "string", "minLength": 3, "maxLength": 253 },
      "description": "Own domains for the citation metric; subdomains count."
    },
    "competitors": {
      "type": "array",
      "maxItems": 6,
      "items": { "type": "string", "minLength": 1, "maxLength": 80 },
      "description": "Competitors for share of voice and comparison questions. If omitted, they are extracted from answers."
    },
    "facts": {
      "type": "array",
      "maxItems": 10,
      "items": { "type": "string", "minLength": 3, "maxLength": 200 },
      "description": "Canonical facts used to detect misrepresentation."
    },
    "contractAddress": {
      "type": "string",
      "maxLength": 100,
      "description": "Token contract address (tokens only); adds a trust question."
    },
    "languages": {
      "type": "array",
      "minItems": 1,
      "maxItems": 2,
      "uniqueItems": true,
      "items": { "type": "string", "enum": ["en", "ru"] },
      "default": ["en"],
      "description": "Languages to audit in."
    },
    "customQueries": {
      "type": "array",
      "maxItems": 10,
      "items": { "type": "string", "minLength": 5, "maxLength": 200 },
      "description": "Extra questions to ask; language is detected by Cyrillic characters."
    }
  }
}
