{
  "subject": "Virtuals Protocol",
  "subjectType": "token",
  "category": "AI agent launchpads",
  "aliases": ["$VIRTUAL", "Virtuals"],
  "domains": ["virtuals.io"],
  "competitors": ["ai16z", "Fetch.ai", "Olas"],
  "facts": [
    "VIRTUAL has a total supply of 1 billion tokens",
    "Virtuals Protocol launched on the Base network",
    "Agents launched on Virtuals are paired with VIRTUAL in liquidity pools"
  ],
  "contractAddress": "0x0b3e328455c4059EEb9e3f84b5543F74E24e7E1b",
  "languages": ["en", "ru"],
  "customQueries": ["How do I launch my own AI agent token?"]
}
